{
  "allow_failure": false,
  "depends_on": [],
  "experiment_id": "din_lite_history",
  "hypothesis": "Strictly prior recency-weighted click history improves the matching BPR seed.",
  "node_id": "din-lite-seed-1",
  "objective": {
    "direction": "maximize",
    "metric": "validation.combined"
  },
  "parameters": {
    "alpha": 0.025,
    "author_weight": 0.5,
    "base_model": "results/part4_bpr/nodes/bpr-seed-1/model.npz",
    "base_model_sha256": "e5e3a004cdc21100ba0374bb87dc98fe871c11f19af32cdbc8ba3ec523a46b79",
    "data_dir": "KuaiRand-Pure/data",
    "duration_weight": 0.1,
    "evaluation_batch_size": 128,
    "max_history": 50,
    "recency_decay": 0.05
  },
  "schema_version": 1,
  "seed": 1,
  "template": "din_lite"
}
