{
  "allow_failure": false,
  "depends_on": [],
  "experiment_id": "shared_bottom_multitask",
  "hypothesis": "Training-only auxiliary feedback improves click ranking beyond matched BPR continuation.",
  "node_id": "multitask-seed-0",
  "objective": {
    "direction": "maximize",
    "metric": "validation.combined"
  },
  "parameters": {
    "auxiliary_fraction": 0.25,
    "auxiliary_learning_rate": 0.01,
    "auxiliary_strength": 0.1,
    "base_model": "results/part4_bpr/nodes/bpr-seed-0/model.npz",
    "base_model_sha256": "8e0d21f5fc6bbad967a1376e2e3053903ecc3a6b30d4e9260df8d60c012ed4be",
    "batch_size": 8192,
    "data_dir": "KuaiRand-Pure/data",
    "epochs": 1,
    "evaluation_batch_size": 128,
    "learning_rate": 0.001,
    "task_weights": {}
  },
  "schema_version": 1,
  "seed": 0,
  "template": "multitask_fm"
}
