{
  "allow_failure": false,
  "depends_on": [],
  "experiment_id": "din_lite_history",
  "hypothesis": "Chronological history is the second research priority.",
  "node_id": "din-lite-smoke",
  "objective": {
    "direction": "maximize",
    "metric": "validation.synthetic_proxy"
  },
  "parameters": {
    "base_score": 0.5,
    "jitter": 0.0001,
    "uplift": 0.03
  },
  "schema_version": 1,
  "seed": 1,
  "template": "synthetic_ranker"
}
