{
  "allow_failure": false,
  "depends_on": [],
  "experiment_id": "shared_bottom_multitask",
  "hypothesis": "Multi-task supervision is the third research priority.",
  "node_id": "multitask-smoke",
  "objective": {
    "direction": "maximize",
    "metric": "validation.synthetic_proxy"
  },
  "parameters": {
    "base_score": 0.5,
    "jitter": 0.0001,
    "uplift": 0.025
  },
  "schema_version": 1,
  "seed": 2,
  "template": "synthetic_ranker"
}
