{
  "allow_failure": false,
  "depends_on": [],
  "experiment_id": "bpr_continuation_control",
  "hypothesis": "Matched BPR continuation controls for additional primary training.",
  "node_id": "control-seed-2",
  "objective": {
    "direction": "maximize",
    "metric": "validation.combined"
  },
  "parameters": {
    "auxiliary_fraction": 0.25,
    "auxiliary_learning_rate": 0.01,
    "auxiliary_strength": 0.0,
    "base_model": "results/part4_bpr/nodes/bpr-seed-2/model.npz",
    "base_model_sha256": "2881f6a772db42375f0b10e0881fffabf6023e2bbf29c18b0c85cfa5b398dad6",
    "batch_size": 8192,
    "data_dir": "KuaiRand-Pure/data",
    "epochs": 1,
    "evaluation_batch_size": 128,
    "learning_rate": 0.001,
    "task_weights": {}
  },
  "schema_version": 1,
  "seed": 2,
  "template": "multitask_fm"
}
