{
  "allow_failure": false,
  "depends_on": [],
  "experiment_id": "bpr_fm",
  "hypothesis": "Pairwise objective alignment is the first research priority.",
  "node_id": "bpr-fm-smoke",
  "objective": {
    "direction": "maximize",
    "metric": "validation.synthetic_proxy"
  },
  "parameters": {
    "base_score": 0.5,
    "jitter": 0.0001,
    "uplift": 0.02
  },
  "schema_version": 1,
  "seed": 0,
  "template": "synthetic_ranker"
}
