{
  "allow_failure": false,
  "depends_on": [],
  "experiment_id": "bpr_reference",
  "hypothesis": "The previous global best remains protected unless DIN-lite exceeds it.",
  "node_id": "bpr-global-best-reference",
  "objective": {
    "direction": "maximize",
    "metric": "validation.combined"
  },
  "parameters": {
    "combined": 0.0743083838123746,
    "model": "results/part4_bpr/nodes/bpr-seed-3/model.npz",
    "model_sha256": "53d4b237e6534c84377c69b8d179f41b467261312f784a0f0ee70885211fccc4",
    "ndcg_at_10": 0.027412282871199182,
    "recall_at_50": 0.12120448475355003
  },
  "schema_version": 1,
  "seed": 3,
  "template": "checkpoint_reference"
}
